{
  "scene_id": "plotter_cell_square",
  "spec_version": "1.0",
  "units": "m",
  "physics": {
    "gravity": [
      0,
      0,
      -9.81
    ],
    "physics_dt": 0.008333,
    "solver": "tgs"
  },
  "ground": {
    "size": [
      1.5,
      1.5
    ],
    "friction": 0.8
  },
  "lighting": "dome",
  "assets": [
    {
      "id": "ground",
      "type": "ground",
      "pose": {
        "position": [
          0,
          0,
          0
        ]
      },
      "params": {
        "size": [
          1.5,
          1.5
        ],
        "friction": 0.8
      }
    },
    {
      "id": "table",
      "type": "work_table",
      "pose": {
        "position": [
          0.5,
          0.5,
          0.0
        ]
      },
      "params": {
        "size": [
          1.2,
          1.2,
          0.75
        ],
        "paper_area": "20..80 x 20..80"
      }
    },
    {
      "id": "x_axis",
      "type": "linear_axis",
      "pose": {
        "position": [
          0.5,
          0.5,
          0.78
        ],
        "rpy_deg": [
          0,
          0,
          0
        ]
      },
      "params": {
        "axis": "x",
        "axis_type": "linear",
        "stroke": [
          0.0,
          100.0
        ],
        "unit": "%",
        "vmax": 40.0,
        "accel": 80.0,
        "poswin": 2.0,
        "scale_m_per_unit": 0.01
      }
    },
    {
      "id": "y_axis",
      "type": "linear_axis",
      "pose": {
        "position": [
          0.5,
          0.5,
          0.78
        ],
        "rpy_deg": [
          0,
          0,
          0
        ]
      },
      "params": {
        "axis": "y",
        "axis_type": "linear",
        "stroke": [
          0.0,
          100.0
        ],
        "unit": "%",
        "vmax": 40.0,
        "accel": 80.0,
        "poswin": 2.0,
        "scale_m_per_unit": 0.01
      }
    },
    {
      "id": "z_axis",
      "type": "linear_axis",
      "pose": {
        "position": [
          0.5,
          0.5,
          0.78
        ],
        "rpy_deg": [
          0,
          0,
          0
        ]
      },
      "params": {
        "axis": "z",
        "axis_type": "linear",
        "stroke": [
          0.0,
          10.0
        ],
        "unit": "mm",
        "vmax": 20.0,
        "accel": 60.0,
        "poswin": 1.0,
        "scale_m_per_unit": 0.001
      }
    },
    {
      "id": "plot_head",
      "type": "tool_head",
      "parent": "y_axis",
      "pose": {
        "position": [
          0.5,
          0.5,
          0.79
        ]
      },
      "params": {
        "carries": "pen",
        "acceptance_asset": true
      }
    },
    {
      "id": "pen",
      "type": "pen",
      "parent": "plot_head",
      "pose": {
        "position": [
          0.5,
          0.5,
          0.785
        ]
      },
      "params": {
        "tip_diameter_mm": 0.5,
        "stroke_mm": 10
      }
    },
    {
      "id": "panel",
      "type": "hmi_panel",
      "pose": {
        "position": [
          -0.35,
          0.5,
          0.0
        ]
      },
      "params": {
        "buttons": [
          "cmd_draw",
          "cmd_go",
          "cmd_home",
          "cmd_reset",
          "jog_fwd",
          "jog_rev",
          "quickstop",
          "run"
        ],
        "lamps": [
          "all_oe",
          "any_moving",
          "fault_any",
          "move_done",
          "pen_down",
          "plot_done"
        ]
      }
    }
  ],
  "script": {
    "termination": {
      "max_sim_time": 90.0,
      "early_stop": "plot_done settled"
    }
  },
  "io_map": [
    {
      "plc_var": "AxisX_cmd",
      "dir": "output",
      "type": "float",
      "bind": {
        "asset": "x_axis",
        "quantity": "cmd",
        "range": [
          0.0,
          1.0
        ]
      }
    },
    {
      "plc_var": "AxisY_cmd",
      "dir": "output",
      "type": "float",
      "bind": {
        "asset": "y_axis",
        "quantity": "cmd",
        "range": [
          0.0,
          1.0
        ]
      }
    },
    {
      "plc_var": "AxisZ_cmd",
      "dir": "output",
      "type": "float",
      "bind": {
        "asset": "z_axis",
        "quantity": "cmd",
        "range": [
          0.0,
          0.01
        ]
      }
    },
    {
      "plc_var": "AxisX_pos",
      "dir": "input",
      "type": "float",
      "bind": {
        "asset": "x_axis",
        "quantity": "pos",
        "range": [
          0.0,
          1.0
        ]
      }
    },
    {
      "plc_var": "AxisY_pos",
      "dir": "input",
      "type": "float",
      "bind": {
        "asset": "y_axis",
        "quantity": "pos",
        "range": [
          0.0,
          1.0
        ]
      }
    },
    {
      "plc_var": "AxisZ_pos",
      "dir": "input",
      "type": "float",
      "bind": {
        "asset": "z_axis",
        "quantity": "pos",
        "range": [
          0.0,
          0.01
        ]
      }
    }
  ]
}